<?xml version="1.0" encoding="UTF-8"?>
<eb:builds xmlns:eb="http://ebsa.ipt.com/EnvironmentBuildSequence-1.0"
	xmlns:vc="http://ebsa.ipt.com/VCloudCommand-2.0" xmlns:xsi="http://www.w3.org/2001/XMLSchema-instance"
	xsi:schemaLocation="http://ebsa.ipt.com/EnvironmentBuildSequence-1.0 ../../../main/resources/EnvironmentBuildSchema-1.0.xsd ">
	<eb:globalparams>
		<eb:param name="global_1" value="Bruce" />
		<eb:param name="global_2" value="Lance" />
		<eb:param name="global_3" value="Julian" />
	</eb:globalparams>
	<eb:environment name="hostile" >
		<eb:buildref id="UniqueIdentifityForThisBuildRef" displayname="Standard EBSA Build" buildid="prod_like" />
	</eb:environment>
	<eb:build id="prod_like">
		<eb:param name="build_1" value="Rod" />
		<eb:param name="build_2" value="Jane" />
		<eb:param name="build_3" value="Freddy" />
	</eb:build>
	<eb:sequence id="S2">
		<eb:step actionid="Release the hounds" context="step_context_param_1=Rosie" />
	</eb:sequence>
	<eb:action id="Release the hounds">
		<eb:sshcommand machine="" sshoptsfile="" remotecommand="" />
	</eb:action>
</eb:builds>